{
  "schema_version": "engineer-osint-patch-v1",
  "state": {
    "run_id": "engineer-osint-20260826-B83",
    "parent_run_id": "engineer-osint-20260826-B82",
    "status": "SUCCESS",
    "window_from": "2026-08-26T16:10:37+02:00",
    "window_to": "2026-08-26T16:55:12+02:00",
    "counts": {
      "CURRENT_DELTA": 0,
      "LATE_DISCOVERED_CURRENT": 0,
      "HISTORICAL_BACKFILL": 0,
      "ENTITY_ENRICHMENT": 0,
      "NEW": 0,
      "UPDATE": 0,
      "CONFIRMATION": 0,
      "CORRECTION": 0,
      "CONTRADICTION": 0,
      "LEAD": 0,
      "NEW_RELATIONS": 0,
      "UPDATED_RELATIONS": 0,
      "NEW_EVIDENCE": 0,
      "UPDATED_EVIDENCE": 0,
      "NEW_SOURCES": 0,
      "UPDATED_SOURCES": 0,
      "NEW_VISUALS": 0,
      "NEW_MEDIA": 0
    }
  },
  "continuity": {
    "status": "COMPLETE_PUBLICATION_LAG_CONTIGUOUS",
    "factual_success_tip_before_run": "engineer-osint-20260826-B82",
    "published_tip": "engineer-osint-20260825-B74",
    "publication_lag_before_run": 8,
    "unpublished_success_chain_before_run": [
      "engineer-osint-20260826-B75",
      "engineer-osint-20260826-B76",
      "engineer-osint-20260826-B77",
      "engineer-osint-20260826-B78",
      "engineer-osint-20260826-B79",
      "engineer-osint-20260826-B80",
      "engineer-osint-20260826-B81",
      "engineer-osint-20260826-B82"
    ],
    "main_sha_at_start": "6dfadf749053e5a5ef74800a214c325d3c5e61d9",
    "main_sha_before_production_write": "6dfadf749053e5a5ef74800a214c325d3c5e61d9",
    "reconciliation_window_from": "2026-08-24T16:55:12+02:00",
    "reconciliation_window_to": "2026-08-26T16:55:12+02:00",
    "mandatory_unpublished_artifacts_reverified": "PASS_INHERITED_B75_B81_FROM_B82_PLUS_RAW_READBACK_B82_DELTA_REPORT_HISTORICAL",
    "lead_001_canonicalization_gate": "NOT_REAPPLIED_ALREADY_CANONICAL_IN_B75_DRIVE_CHAIN_GITHUB_HANDOFF_STALE"
  },
  "true_delta": {
    "CURRENT_DELTA": 0,
    "LATE_DISCOVERED_CURRENT": 0,
    "HISTORICAL_BACKFILL": 0,
    "ENTITY_ENRICHMENT": 0
  },
  "new_records": [],
  "updated_records": [],
  "sources": [],
  "relations": [],
  "evidence": [],
  "visuals": [],
  "media": [],
  "technology_signals": [],
  "lead_updates": [],
  "observed_minimum_updates": [],
  "lessons_learned": [],
  "qa": {
    "publication_safety": "PASS_NO_NEW_PUBLIC_ITEM",
    "bilingual_precheck": "NOT_APPLICABLE_ZERO_DELTA",
    "public_cz_ratchet_status": "NOT_APPLICABLE_ZERO_DELTA_REPOSITORY_RATCHET_NOT_RUN",
    "repository_native_validation": "NOT_RUN_NOT_MATERIALIZED",
    "multimedia_status": "COMPLETE_NO_CANONICAL_MEDIA_ADDITION",
    "telegram_status": "TELEGRAM_SWEEP_NOT_ACCESSIBLE_PUBLIC_WEB_INDEX_DISCOVERY_ONLY",
    "direct_image_inspection": 0,
    "direct_video_frame_inspection": 0,
    "visual_status": "NO_NEW_CANONICAL_VISUALS",
    "russia_ukraine_status": "SWEEP_COMPLETE_NO_NEW_SAFE_QUALIFIED_CANONICAL_ITEM",
    "czech_status": "SWEEP_COMPLETE_NO_NEW_CANONICAL_ITEM",
    "nato_other_status": "SWEEP_COMPLETE_NO_NEW_CANONICAL_ITEM",
    "doctrine_stanag_status": "SWEEP_COMPLETE_NO_NEW_CANONICAL_ITEM",
    "technology_signal_status": "SWEEP_COMPLETE_NO_NEW_CANONICAL_ITEM",
    "source_discovery_status": "COMPLETE_PUBLIC_WEB_AND_TELEGRAM_INDEX_DISCOVERY_NO_NEW_CANONICAL_PROMOTION",
    "undated_nato_fle_disposition": "DISCOVERY_ONLY_UNDATED_PAGE_NOT_PROMOTED_AS_CURRENT_EVENT",
    "osint_safety": "PASS"
  }
}
