{
  "schema_version": "engineer-osint-patch-v1",
  "state": {
    "run_id": "engineer-osint-20260826-B86",
    "parent_run_id": "engineer-osint-20260826-B85",
    "status": "SUCCESS",
    "window_from": "2026-08-26T18:07:13+02:00",
    "window_to": "2026-08-26T18:18:54+02:00",
    "counts": {
      "CURRENT_DELTA": 0,
      "LATE_DISCOVERED_CURRENT": 0,
      "HISTORICAL_BACKFILL": 0,
      "ENTITY_ENRICHMENT": 0,
      "NEW": 0,
      "UPDATE": 0,
      "CONFIRMATION": 0,
      "CORRECTION": 0,
      "CONTRADICTION": 0,
      "LEAD": 0,
      "NEW_RELATIONS": 0,
      "UPDATED_RELATIONS": 0,
      "NEW_EVIDENCE": 0,
      "UPDATED_EVIDENCE": 0,
      "NEW_SOURCES": 0,
      "UPDATED_SOURCES": 0,
      "NEW_VISUALS": 0,
      "NEW_MEDIA": 0
    }
  },
  "continuity": {
    "status": "COMPLETE_PUBLICATION_LAG_ANCESTOR_ONLY",
    "factual_success_tip_before_run": "engineer-osint-20260826-B85",
    "published_tip": "engineer-osint-20260825-B74",
    "publication_lag_before_run": 11,
    "publication_lag_after_run": 12,
    "github_parent_canonical_sha256": "63d087b707905e6eb8fbb654863cff9ac74849dd3cbe8003914facc136ba8848",
    "main_sha_at_start": "6dfadf749053e5a5ef74800a214c325d3c5e61d9",
    "reconciliation_window_from": "2026-08-24T18:18:54+02:00",
    "reconciliation_window_to": "2026-08-26T18:18:54+02:00",
    "source_state": "ENGINEER_OSINT/_state/engineer_osint_state_latest.json",
    "unpublished_success_chain_after_run": [
      "engineer-osint-20260826-B75",
      "engineer-osint-20260826-B76",
      "engineer-osint-20260826-B77",
      "engineer-osint-20260826-B78",
      "engineer-osint-20260826-B79",
      "engineer-osint-20260826-B80",
      "engineer-osint-20260826-B81",
      "engineer-osint-20260826-B82",
      "engineer-osint-20260826-B83",
      "engineer-osint-20260826-B84",
      "engineer-osint-20260826-B85",
      "engineer-osint-20260826-B86"
    ]
  },
  "true_delta": {
    "CURRENT_DELTA": 0,
    "LATE_DISCOVERED_CURRENT": 0,
    "HISTORICAL_BACKFILL": 0,
    "ENTITY_ENRICHMENT": 0
  },
  "new_records": [],
  "updated_records": [],
  "sources": [],
  "relations": [],
  "evidence": [],
  "visuals": [],
  "media": [],
  "technology_signals": [],
  "lead_updates": [],
  "observed_minimum_updates": [],
  "lessons_learned": [],
  "qa": {
    "publication_safety": "PASS_NO_NEW_PUBLIC_ITEMS",
    "bilingual_precheck": "NOT_APPLICABLE_ZERO_DELTA",
    "public_cz_ratchet_status": "NOT_APPLICABLE_ZERO_DELTA_REPOSITORY_RATCHET_NOT_RUN",
    "repository_native_validation": "NOT_RUN_NOT_MATERIALIZED",
    "telegram_status": "TELEGRAM_SWEEP_NOT_ACCESSIBLE_PUBLIC_WEB_INDEX_DISCOVERY_ONLY",
    "social_discovery_status": "PUBLIC_WEB_DISCOVERY_COMPLETE_NO_NEW_CANONICAL_PROMOTION",
    "direct_image_inspection": 0,
    "direct_video_frame_inspection": 0,
    "visual_status": "NO_NEW_CANONICAL_VISUALS",
    "multimedia_status": "COMPLETE_NO_CANONICAL_MEDIA_ADDITION",
    "doctrine_stanag_status": "SWEEP_COMPLETE_NO_NEW_CANONICAL_ITEM",
    "technology_signal_status": "SWEEP_COMPLETE_NO_NEW_CANONICAL_ITEM",
    "russia_ukraine_status": "SWEEP_COMPLETE_NO_NEW_SAFE_QUALIFIED_CANONICAL_ITEM_AFTER_B85",
    "czech_status": "SWEEP_COMPLETE_NO_NEW_CANONICAL_ITEM",
    "nato_other_status": "SWEEP_COMPLETE_NO_NEW_CANONICAL_ITEM",
    "lead_001_canonicalization": {
      "status": "REVIEW_REQUIRED_ALREADY_CANONICAL_IN_B75_HANDOFF_PREPARED_AGAINST_B74_NOT_REAPPLIED",
      "handoff_file": "docs/engineer-osint/LEAD_001_CANONICALIZATION_HANDOFF.md",
      "handoff_prepared_tip": "engineer-osint-20260825-B74",
      "live_lead_has_claims": true,
      "live_claim_id": "LEAD-001-CLAIM-EODCOE-ANALYSIS",
      "overlay_removed_by_factual_producer": false
    },
    "osint_safety_note_cs": "Nevznikla žádná nová veřejná položka; nebyly přeneseny přesné aktuální taktické polohy, zneužitelné zranitelnosti ani praktické návody k nebezpečné manipulaci.",
    "osint_safety_note_en": "No new public item was created; no precise current tactical locations, exploitable vulnerabilities, or actionable dangerous-handling instructions were transferred."
  },
  "presentation_fact_overlay_gap": "OPEN_LEGACY_RUNTIME_OVERLAYS_REMAIN",
  "extensions": {}
}
