{
  "schema_version": "engineer-osint-patch-v1",
  "state": {
    "run_id": "engineer-osint-20260826-B78",
    "parent_run_id": "engineer-osint-20260826-B77",
    "status": "SUCCESS",
    "window_from": "2026-08-26T13:59:30+02:00",
    "window_to": "2026-08-26T14:10:25+02:00",
    "counts": {
      "CURRENT_DELTA": 0,
      "LATE_DISCOVERED_CURRENT": 0,
      "HISTORICAL_BACKFILL": 0,
      "ENTITY_ENRICHMENT": 0,
      "NEW": 0,
      "UPDATE": 0,
      "CONFIRMATION": 0,
      "CORRECTION": 0,
      "CONTRADICTION": 0,
      "LEAD": 0,
      "NEW_RELATIONS": 0,
      "UPDATED_RELATIONS": 0,
      "NEW_EVIDENCE": 0,
      "UPDATED_EVIDENCE": 0,
      "NEW_SOURCES": 0,
      "UPDATED_SOURCES": 0,
      "NEW_VISUALS": 0,
      "NEW_MEDIA": 0
    }
  },
  "continuity": {
    "status": "COMPLETE_WITH_NORMAL_PUBLICATION_LAG",
    "drive_parent_run_id": "engineer-osint-20260826-B77",
    "factual_success_tip_before_run": "engineer-osint-20260826-B77",
    "github_run_store_parent_run_id": "engineer-osint-20260825-B74",
    "published_tip": "engineer-osint-20260825-B74",
    "github_parent_canonical_sha256": "63d087b707905e6eb8fbb654863cff9ac74849dd3cbe8003914facc136ba8848",
    "source_state": "ENGINEER_OSINT/_state/engineer_osint_state_latest.json",
    "reconciliation_window_from": "2026-08-24T14:10:25+02:00",
    "reconciliation_window_to": "2026-08-26T14:10:25+02:00",
    "main_sha_at_start": "6dfadf749053e5a5ef74800a214c325d3c5e61d9",
    "publication_lag_before_run": 3,
    "unpublished_success_chain_before_run": [
      "engineer-osint-20260826-B75",
      "engineer-osint-20260826-B76",
      "engineer-osint-20260826-B77"
    ],
    "unpublished_success_chain_after_run": [
      "engineer-osint-20260826-B75",
      "engineer-osint-20260826-B76",
      "engineer-osint-20260826-B77",
      "engineer-osint-20260826-B78"
    ]
  },
  "true_delta": {
    "CURRENT_DELTA": 0,
    "LATE_DISCOVERED_CURRENT": 0,
    "HISTORICAL_BACKFILL": 0,
    "ENTITY_ENRICHMENT": 0
  },
  "new_records": [],
  "updated_records": [],
  "sources": [],
  "relations": [],
  "evidence": [],
  "visuals": [],
  "media": [],
  "technology_signals": [],
  "lead_updates": [],
  "observed_minimum_updates": [],
  "lessons_learned": [],
  "qa": {
    "publication_safety": "PUBLIC_OK",
    "bilingual_precheck": "NOT_APPLICABLE_ZERO_DELTA",
    "public_cz_ratchet_status": "NOT_APPLICABLE_ZERO_DELTA_REPOSITORY_RATCHET_NOT_RUN",
    "repository_native_validation": "NOT_RUN_ZERO_DELTA_NOT_MATERIALIZED",
    "telegram_status": "TELEGRAM_SWEEP_NOT_ACCESSIBLE",
    "social_discovery_status": "PUBLIC_WEB_DISCOVERY_COMPLETE_NO_CANONICAL_PROMOTION",
    "direct_image_inspection": 0,
    "direct_video_frame_inspection": 0,
    "visual_status": "NO_NEW_CANONICAL_VISUALS",
    "multimedia_status": "COMPLETE_NO_CANONICAL_MEDIA_ADDITION",
    "doctrine_stanag_status": "SWEEP_COMPLETE_NO_NEW_CANONICAL_ITEM",
    "technology_signal_status": "SWEEP_COMPLETE_NO_NEW_CANONICAL_ITEM",
    "russia_ukraine_status": "SWEEP_COMPLETE_NO_NEW_CANONICAL_ITEM_AFTER_B77",
    "czech_status": "SWEEP_COMPLETE_NO_NEW_CANONICAL_ITEM",
    "nato_other_status": "SWEEP_COMPLETE_NO_NEW_CANONICAL_ITEM",
    "lead_001_one_time_status": "REVIEW_REQUIRED_ALREADY_CANONICAL_IN_B75_HANDOFF_PREPARED_AGAINST_B74_NOT_REAPPLIED",
    "lead_001_review_reason_en": "The live canonical LEAD-001 already contains the reviewed claim and the handoff was prepared against B74, so the one-time canonicalization is not replayed. A fresh review is required before any further overlay-retirement action.",
    "lead_001_review_reason_cs": "Živý kanonický LEAD-001 již obsahuje reviewovaný claim a handoff byl připraven proti B74, proto se jednorázová kanonikalizace neopakuje. Před další akcí k odstranění overlaye je vyžadován nový review."
  },
  "presentation_fact_overlay_gap": "OPEN",
  "extensions": {}
}
