{
  "schema_version": "engineer-osint-patch-v1",
  "state": {
    "run_id": "engineer-osint-20260825-B70",
    "parent_run_id": "engineer-osint-20260825-B69",
    "status": "SUCCESS",
    "window_from": "2026-08-25T20:41:01+02:00",
    "window_to": "2026-08-25T21:12:41+02:00",
    "counts": {
      "CURRENT_DELTA": 0,
      "LATE_DISCOVERED_CURRENT": 0,
      "HISTORICAL_BACKFILL": 0,
      "ENTITY_ENRICHMENT": 0,
      "NEW": 0,
      "UPDATE": 0,
      "CONFIRMATION": 0,
      "CORRECTION": 0,
      "CONTRADICTION": 0,
      "LEAD": 0,
      "NEW_RELATIONS": 0,
      "UPDATED_RELATIONS": 0,
      "NEW_EVIDENCE": 0,
      "UPDATED_EVIDENCE": 0,
      "NEW_SOURCES": 0,
      "UPDATED_SOURCES": 0,
      "NEW_VISUALS": 0,
      "NEW_MEDIA": 0
    }
  },
  "continuity": {
    "status": "COMPLETE_ZERO_DELTA_WITH_NORMAL_PUBLICATION_LAG",
    "drive_parent_run_id": "engineer-osint-20260825-B69",
    "factual_success_tip_before_run": "engineer-osint-20260825-B69",
    "github_run_store_parent_run_id": "engineer-osint-20260824-B67",
    "published_tip": "engineer-osint-20260824-B67",
    "github_parent_canonical_sha256": "864383a050164a2fd3d4447b6c45a2cb1865cea6632283f1d65fb91035cddae0",
    "source_state": "ENGINEER_OSINT/_state/engineer_osint_state_latest.json",
    "reconciliation_window_from": "2026-08-23T21:12:41+02:00",
    "reconciliation_window_to": "2026-08-25T21:12:41+02:00",
    "main_sha_at_start": "16679790c471e0ae2fe73fad7d61bacd81dfea12",
    "publication_lag_before_run": 2,
    "unpublished_success_chain_after_run": [
      "engineer-osint-20260824-B68",
      "engineer-osint-20260825-B69",
      "engineer-osint-20260825-B70"
    ]
  },
  "true_delta": {
    "CURRENT_DELTA": 0,
    "LATE_DISCOVERED_CURRENT": 0,
    "HISTORICAL_BACKFILL": 0,
    "ENTITY_ENRICHMENT": 0
  },
  "new_records": [],
  "updated_records": [],
  "sources": [],
  "relations": [],
  "evidence": [],
  "visuals": [],
  "media": [],
  "technology_signals": [],
  "lead_updates": [],
  "observed_minimum_updates": [],
  "lessons_learned": [],
  "qa": {
    "research_sweep_status": "COMPLETE_ZERO_PROMOTION",
    "publication_safety": "PASS_NO_NEW_PUBLIC_RECORDS",
    "bilingual_precheck": "NOT_APPLICABLE_ZERO_NEW_OR_MATERIALLY_CHANGED_PUBLIC_FREE_TEXT",
    "public_cz_ratchet_status": "NOT_RUN_NO_GITHUB_MATERIALIZATION_OLDER_PUBLICATION_BACKLOG",
    "repository_native_validation": "NOT_RUN_PUBLICATION_DEFERRED",
    "schema_local_required_fields": "PASS",
    "duplicate_lineage_check": "PASS_AGAINST_B69_CONTINUATION_STATE",
    "current_delta_status": "NO_QUALIFIED_ITEM_FOUND_IN_SHORT_CURRENT_WINDOW",
    "reconciliation_status": "COMPLETE_NO_NEW_DEDUPLICATED_PROMOTION",
    "russia_ukraine_status": "COMPLETE_NO_NEW_SAFE_QUALIFIED_CANONICAL_ITEM",
    "czech_status": "COMPLETE_NO_NEW_CANONICAL_ITEM",
    "nato_other_status": "COMPLETE_NO_NEW_CANONICAL_ITEM",
    "eod_cied_eoc_eor_status": "COMPLETE_NO_NEW_CANONICAL_ITEM",
    "doctrine_stanag_status": "COMPLETE_NO_NEW_CANONICAL_ITEM",
    "orbat_status": "COMPLETE_NO_NEW_CANONICAL_ITEM",
    "lessons_learned_status": "COMPLETE_NO_NEW_CANONICAL_ITEM",
    "technology_signal_status": "COMPLETE_NO_NEW_CANONICAL_ITEM",
    "source_family_status": "COMPLETE_PRIMARY_SOURCE_RECHECK_NO_PROMOTION",
    "telegram_status": "PARTIAL_WEB_INDEX_DISCOVERY_ONLY_NOT_SUFFICIENT_FOR_NO_HIT",
    "social_discovery_status": "PARTIAL_PUBLIC_WEB_DISCOVERY_NO_CANONICAL_PROMOTION",
    "direct_image_inspection": 0,
    "direct_video_frame_inspection": 0,
    "visual_status": "IMAGE_DISCOVERY_QUERY_COMPLETED_NO_DIRECT_PIXEL_INSPECTION_NO_PROMOTION",
    "multimedia_status": "COMPLETE_NO_CANONICAL_MEDIA_ADDITION",
    "research_note_cs": "V krátkém okně po B69 nebyl nalezen nový kvalifikovaný veřejný factual přírůstek. 48h reconciliation a tematické rechecky neodůvodnily duplicitní ani slabě podloženou publikaci.",
    "research_note_en": "No new qualified public factual item was found in the short window after B69. The 48-hour reconciliation and thematic rechecks did not justify duplicative or weakly supported publication."
  }
}
